{
  "schema_version": 1,
  "map_version": "1.0.0",
  "taxonomy_source": "data/risk/commercial_clause_risk_playbook.json: clause_types",
  "taxonomy_count": 37,
  "authority_catalog_path": "data/risk/authority_catalog.json",
  "default_rule": "All 37 categories are review triggers only. A linked statute is a scope-limited authority lead, not a general enforceability rule. An explicit no-universal-authority entry is not missing data; it means the legal result requires case-specific and jurisdiction-specific research.",
  "clauses": [
    {
      "clause_type": "Anti-Assignment",
      "review_trigger_class": "CONTRACT_TEXT_REVIEW_TRIGGER",
      "authority_ids": [
        "NY_UCC_2_210",
        "DE_UCC_2_210"
      ],
      "authority_coverage_status": "LIMITED_PRIMARY_AUTHORITY_LINKED",
      "jurisdiction_policy": "NY_OR_DE_UCC_ONLY_IF_VALIDLY_GOVERNED_AND_GOODS_TRANSACTION",
      "scope_note": "Use UCC § 2-210 only for a sale-of-goods transaction governed by the named state's UCC. Services, IP licences, receivables, and change-of-control effects require separate law and contract interpretation.",
      "legal_conclusion_allowed": false,
      "required_context": [
        "exact contract quote and clause location",
        "governing-law and forum text",
        "contract type and transaction subject matter",
        "party relationship and relevant facts",
        "effective date and any applicable statutory exceptions"
      ],
      "review_status": "RESEARCH_SEED_NOT_LEGALLY_APPROVED"
    },
    {
      "clause_type": "Audit Rights",
      "review_trigger_class": "CONTRACT_TEXT_REVIEW_TRIGGER",
      "authority_ids": [],
      "authority_coverage_status": "NO_UNIVERSAL_PRIMARY_AUTHORITY_IDENTIFIED",
      "jurisdiction_policy": "NO_DEFAULT_JURISDICTION; CONTRACT_AND_SECTOR_FACTS_REQUIRED",
      "scope_note": "No universal U.S. commercial-contract statute creates a general audit right. Assess scope, frequency, confidentiality, security, cost allocation, records, and sector-specific statutes only when facts identify them.",
      "legal_conclusion_allowed": false,
      "required_context": [
        "exact contract quote and clause location",
        "governing-law and forum text",
        "contract type and transaction subject matter",
        "party relationship and relevant facts",
        "effective date and any applicable statutory exceptions"
      ],
      "review_status": "RESEARCH_SEED_NOT_LEGALLY_APPROVED"
    },
    {
      "clause_type": "Cap On Liability",
      "review_trigger_class": "CONTRACT_TEXT_REVIEW_TRIGGER",
      "authority_ids": [
        "NY_UCC_2_719",
        "DE_UCC_2_719"
      ],
      "authority_coverage_status": "LIMITED_PRIMARY_AUTHORITY_LINKED",
      "jurisdiction_policy": "NY_OR_DE_UCC_ONLY_IF_VALIDLY_GOVERNED_AND_GOODS_TRANSACTION",
      "scope_note": "UCC § 2-719 addresses contractual remedies in sale-of-goods transactions only. Liability caps in service/software and mixed contracts require governing-law-specific case law and any applicable nonwaivable rules.",
      "legal_conclusion_allowed": false,
      "required_context": [
        "exact contract quote and clause location",
        "governing-law and forum text",
        "contract type and transaction subject matter",
        "party relationship and relevant facts",
        "effective date and any applicable statutory exceptions"
      ],
      "review_status": "RESEARCH_SEED_NOT_LEGALLY_APPROVED"
    },
    {
      "clause_type": "Change Of Control",
      "review_trigger_class": "CONTRACT_TEXT_REVIEW_TRIGGER",
      "authority_ids": [
        "DE_DGCL_251",
        "NY_UCC_2_210",
        "DE_UCC_2_210"
      ],
      "authority_coverage_status": "LIMITED_PRIMARY_AUTHORITY_LINKED",
      "jurisdiction_policy": "CORPORATE_LAW_AND_CONTRACT_GOVERNING_LAW_REQUIRED",
      "scope_note": "A corporate merger statute is not a universal change-of-control rule. Separate corporate transaction form, defined control threshold, assignment wording, consent/termination effects, and governing law.",
      "legal_conclusion_allowed": false,
      "required_context": [
        "exact contract quote and clause location",
        "governing-law and forum text",
        "contract type and transaction subject matter",
        "party relationship and relevant facts",
        "effective date and any applicable statutory exceptions"
      ],
      "review_status": "RESEARCH_SEED_NOT_LEGALLY_APPROVED"
    },
    {
      "clause_type": "Exclusivity",
      "review_trigger_class": "CONTRACT_TEXT_REVIEW_TRIGGER",
      "authority_ids": [
        "NY_UCC_2_306",
        "DE_UCC_2_306",
        "USC_15_1"
      ],
      "authority_coverage_status": "LIMITED_PRIMARY_AUTHORITY_LINKED",
      "jurisdiction_policy": "GOODS_UCC_ONLY_FOR_2_306; FEDERAL_ANTITRUST_ONLY_IF_FACTS_SUPPORT",
      "scope_note": "UCC § 2-306 addresses output/requirements and exclusive dealings in goods; antitrust analysis requires market and competitive-effects facts. Exclusivity is not automatically unlawful.",
      "legal_conclusion_allowed": false,
      "required_context": [
        "exact contract quote and clause location",
        "governing-law and forum text",
        "contract type and transaction subject matter",
        "party relationship and relevant facts",
        "effective date and any applicable statutory exceptions"
      ],
      "review_status": "RESEARCH_SEED_NOT_LEGALLY_APPROVED"
    },
    {
      "clause_type": "Governing Law",
      "review_trigger_class": "CONTRACT_TEXT_REVIEW_TRIGGER",
      "authority_ids": [
        "NY_UCC_1_301",
        "NY_GOL_5_1401",
        "NY_GOL_5_1402",
        "DE_UCC_1_301"
      ],
      "authority_coverage_status": "LIMITED_PRIMARY_AUTHORITY_LINKED",
      "jurisdiction_policy": "CHOICE_OF_LAW_AND_FORUM_FACTS_REQUIRED",
      "scope_note": "Check the clause text, transaction value, consumer status, forum clause, contacts, and conflicts rules. The cited UCC sections govern UCC transactions; New York GOL safe harbors have thresholds and exclusions.",
      "legal_conclusion_allowed": false,
      "required_context": [
        "exact contract quote and clause location",
        "governing-law and forum text",
        "contract type and transaction subject matter",
        "party relationship and relevant facts",
        "effective date and any applicable statutory exceptions"
      ],
      "review_status": "RESEARCH_SEED_NOT_LEGALLY_APPROVED"
    },
    {
      "clause_type": "Insurance",
      "review_trigger_class": "CONTRACT_TEXT_REVIEW_TRIGGER",
      "authority_ids": [],
      "authority_coverage_status": "NO_UNIVERSAL_PRIMARY_AUTHORITY_IDENTIFIED",
      "jurisdiction_policy": "CONTRACT_AND_SECTOR_FACTS_REQUIRED",
      "scope_note": "No general U.S. commercial-contract statute establishes one standard insurance requirement for all deals. Treat missing/one-sided coverage as a commercial-review issue unless a sector, licence, construction, transport, or other specific legal requirement is established.",
      "legal_conclusion_allowed": false,
      "required_context": [
        "exact contract quote and clause location",
        "governing-law and forum text",
        "contract type and transaction subject matter",
        "party relationship and relevant facts",
        "effective date and any applicable statutory exceptions"
      ],
      "review_status": "RESEARCH_SEED_NOT_LEGALLY_APPROVED"
    },
    {
      "clause_type": "Ip Ownership Assignment",
      "review_trigger_class": "CONTRACT_TEXT_REVIEW_TRIGGER",
      "authority_ids": [
        "USC_17_101",
        "USC_17_201",
        "USC_17_204",
        "USC_35_261"
      ],
      "authority_coverage_status": "LIMITED_PRIMARY_AUTHORITY_LINKED",
      "jurisdiction_policy": "US_FEDERAL_COPYRIGHT_OR_PATENT_ONLY_WHERE_THAT_RIGHT_IS_AT_ISSUE",
      "scope_note": "Separate copyright, patent, trademark, trade secret, and other rights. Copyright work-for-hire and transfer rules are not interchangeable; patent assignments have their own written-instrument rule.",
      "legal_conclusion_allowed": false,
      "required_context": [
        "exact contract quote and clause location",
        "governing-law and forum text",
        "contract type and transaction subject matter",
        "party relationship and relevant facts",
        "effective date and any applicable statutory exceptions"
      ],
      "review_status": "RESEARCH_SEED_NOT_LEGALLY_APPROVED"
    },
    {
      "clause_type": "Irrevocable Or Perpetual License",
      "review_trigger_class": "CONTRACT_TEXT_REVIEW_TRIGGER",
      "authority_ids": [
        "USC_17_106",
        "USC_17_203",
        "USC_17_204"
      ],
      "authority_coverage_status": "LIMITED_PRIMARY_AUTHORITY_LINKED",
      "jurisdiction_policy": "US_FEDERAL_COPYRIGHT_ONLY_WHERE_COPYRIGHT_GRANT_IS_AT_ISSUE",
      "scope_note": "For copyright grants, distinguish contractual duration from statutory termination rights and the specific grant/author/work facts. Do not infer that 'perpetual' means immune from statutory termination.",
      "legal_conclusion_allowed": false,
      "required_context": [
        "exact contract quote and clause location",
        "governing-law and forum text",
        "contract type and transaction subject matter",
        "party relationship and relevant facts",
        "effective date and any applicable statutory exceptions"
      ],
      "review_status": "RESEARCH_SEED_NOT_LEGALLY_APPROVED"
    },
    {
      "clause_type": "License Grant",
      "review_trigger_class": "CONTRACT_TEXT_REVIEW_TRIGGER",
      "authority_ids": [
        "USC_17_106",
        "USC_17_204",
        "USC_35_261"
      ],
      "authority_coverage_status": "LIMITED_PRIMARY_AUTHORITY_LINKED",
      "jurisdiction_policy": "IP_TYPE_AND_GOVERNING_LAW_REQUIRED",